type,post_id,title,author,body,created_timestamp,score,num_comments,comment_id,comment_author,comment_body,comment_created_timestamp,comment_score,permalink,subreddit
comment,1l41o5w,,,,,,,mw5bhjx,AutoModerator,"It's awesome that you made a profitable trade. Include reasons why you chose this trade so that new traders can learn. **If the reason for the trade is not mentioned your post will be removed**. Your reason can be as simple as: 'Went long on XYZ FUT because it was near support and had good volumes'. Not sure which flair to use? Check out our guide to post flairs [here](https://www.reddit.com/r/IndianStreetBets/wiki/index/postflair)


*I am a bot, and this action was performed automatically. Please [contact the moderators of this subreddit](/message/compose/?to=/r/IndianStreetBets) if you have any questions or concerns.*",2025-06-05 15:11:34,1.0,https://reddit.com/r/IndianStreetBets/comments/1l41o5w/20k_option_buying_challenge/,IndianStreetBets
comment,1l41o5w,,,,,,,mw5s95y,Smart_Ad_5834,What was stop loss?,2025-06-05 16:31:20,1.0,https://reddit.com/r/IndianStreetBets/comments/1l41o5w/20k_option_buying_challenge/,IndianStreetBets
comment,1l41o5w,,,,,,,mw67q4f,bucketbrah247,What are ur trades for tmrw?,2025-06-05 17:43:14,1.0,https://reddit.com/r/IndianStreetBets/comments/1l41o5w/20k_option_buying_challenge/,IndianStreetBets
post,1kkj9qk,Thank you Modiji for peace,Own_Performance_7708,"Bought infy last week thinking inr depreciation will increase export profits. Thanks to ceasefire, it has risen.",2025-05-12 03:53:14,47.0,12.0,,,,,,https://reddit.com/r/IndianStreetBets/comments/1kkj9qk/thank_you_modiji_for_peace/,IndianStreetBets
comment,1kkj9qk,,,,,,,mruyp4u,ReverseSalmonLadder,Thank you Dolund Pump,2025-05-12 03:56:17,24.0,https://reddit.com/r/IndianStreetBets/comments/1kkj9qk/thank_you_modiji_for_peace/,IndianStreetBets
comment,1kkj9qk,,,,,,,mrv7qg2,SorryNegotiation4977,"You just gambled, which ended on positive side. nothing else",2025-05-12 05:12:49,12.0,https://reddit.com/r/IndianStreetBets/comments/1kkj9qk/thank_you_modiji_for_peace/,IndianStreetBets
comment,1kkj9qk,,,,,,,mrva749,abi_helpdesk,It is Donald Trump ... It is because of him they came to cease fire.,2025-05-12 05:35:27,7.0,https://reddit.com/r/IndianStreetBets/comments/1kkj9qk/thank_you_modiji_for_peace/,IndianStreetBets
comment,1kkj9qk,,,,,,,mrv29ae,Jaded-Total6054,Doland trump also🙏,2025-05-12 04:25:27,5.0,https://reddit.com/r/IndianStreetBets/comments/1kkj9qk/thank_you_modiji_for_peace/,IndianStreetBets
comment,1kkj9qk,,,,,,,mruyb9v,AutoModerator,"Adhere to the rules in the sidebar. Use the right Flair. Not sure which flair to use? Check out our guide to post flairs [here](https://www.reddit.com/r/IndianStreetBets/wiki/index/postflair). **If this post has good insights or well research, tag the Mods so we can give a shoutout on Discord and get the post more traction**


*I am a bot, and this action was performed automatically. Please [contact the moderators of this subreddit](/message/compose/?to=/r/IndianStreetBets) if you have any questions or concerns.*",2025-05-12 03:53:16,2.0,https://reddit.com/r/IndianStreetBets/comments/1kkj9qk/thank_you_modiji_for_peace/,IndianStreetBets
post,1h3v8q6,10 Lakhs is my target for this financial year | To give context I am swing trader who failed to follow strict stop loss leading to this unrealised loss | But I have bounced back from -25% this unrealised loss is just 10% of my portfolio,Formal-Durian6300,,2024-12-01 04:34:13,29.0,36.0,,,,,,https://reddit.com/r/IndianStreetBets/comments/1h3v8q6/10_lakhs_is_my_target_for_this_financial_year_to/,IndianStreetBets
comment,1h3v8q6,,,,,,,lztugkn,NoiceAndToitt,"This dude posts here every month, he gets shit on constantly for his terrible returns, and he start crying the moment he gets called out.

He’s definitely a shit trader.",2024-12-01 05:06:57,14.0,https://reddit.com/r/IndianStreetBets/comments/1h3v8q6/10_lakhs_is_my_target_for_this_financial_year_to/,IndianStreetBets
comment,1h3v8q6,,,,,,,lztte9z,aashish2137,"On a capital of 41 lakhs? It's not looking very good right now given we had a bull run until end of September. I say this because my swing trading returns were approx 50% when Nifty was ATH and has dropped 5%ish since then. 

Your target of 10 lakh net realized is good, but hard to achieve. Is there a plan? Are you changing the way you trade? What makes you feel you can get to 10 from 2?",2024-12-01 04:58:28,13.0,https://reddit.com/r/IndianStreetBets/comments/1h3v8q6/10_lakhs_is_my_target_for_this_financial_year_to/,IndianStreetBets
comment,1h3v8q6,,,,,,,lztt1jo,chatgptbotindia,"What I understand is that you buy a few stocks and sell the one's in green , you keep the one's in red untill they turn back to green.",2024-12-01 04:55:40,8.0,https://reddit.com/r/IndianStreetBets/comments/1h3v8q6/10_lakhs_is_my_target_for_this_financial_year_to/,IndianStreetBets
comment,1h3v8q6,,,,,,,lzty3c8,aashish2137,Your 85% doesn't show in your p&l,2024-12-01 05:37:17,8.0,https://reddit.com/r/IndianStreetBets/comments/1h3v8q6/10_lakhs_is_my_target_for_this_financial_year_to/,IndianStreetBets
comment,1h3v8q6,,,,,,,lztqtug,Parth_NB,Book your losses don't hold onto them.,2024-12-01 04:38:24,5.0,https://reddit.com/r/IndianStreetBets/comments/1h3v8q6/10_lakhs_is_my_target_for_this_financial_year_to/,IndianStreetBets
post,1jqdyek,Indian IT stocks CRASH! Here's all you need to know!,The_Market_Maven,"The Nifty IT index dropped 4.05%, with Infosys, TCS, and HCL Tech leading the fall after Trump imposed a 26% tariff on Indian imports.

But the bigger worry? Over 50% of Indian IT revenue comes from the US. If the US economy slows, companies may cut Tech budgets, hurting Indian IT firms.

Add AI automation and inflation fears, the road ahead looks uncertain.

Here's a quick breakdown:

* Trump's new tariffs are raising concerns about trade barriers and cost pressures.
* Higher U.S. inflation risks leading to tighter corporate budgets and reduced Tech spending.
* The drop in U.S. Tech stocks is impacting sentiment and demand for Indian IT services.
* The weakening dollar is affecting revenue from U.S. clients.
* AI & automation risks reducing reliance on traditional outsourcing.",2025-04-03 09:29:17,14.0,15.0,,,,,,https://reddit.com/r/IndianStreetBets/comments/1jqdyek/indian_it_stocks_crash_heres_all_you_need_to_know/,IndianStreetBets
comment,1jqdyek,,,,,,,mlawr86,Ashinfinite,"I have my doubt Indian IT provides services and tariffs are on goods mainly. 

How come 26% tariffs on goods going to affect services",2025-04-04 01:29:33,6.0,https://reddit.com/r/IndianStreetBets/comments/1jqdyek/indian_it_stocks_crash_heres_all_you_need_to_know/,IndianStreetBets
comment,1jqdyek,,,,,,,ml6o60n,coldstone87,"Trump tariffs are probably the reason they crack in short term. 

In the long term they will go back to their 2008 valuations when AI is going to hit them hard. They have no plan to face this AI disaster. ",2025-04-03 11:48:44,5.0,https://reddit.com/r/IndianStreetBets/comments/1jqdyek/indian_it_stocks_crash_heres_all_you_need_to_know/,IndianStreetBets
comment,1jqdyek,,,,,,,ml6y1l1,MAK_01,What is this app or website you're using?,2025-04-03 12:54:44,3.0,https://reddit.com/r/IndianStreetBets/comments/1jqdyek/indian_it_stocks_crash_heres_all_you_need_to_know/,IndianStreetBets
comment,1jqdyek,,,,,,,mlcfgpk,Repulsive-Photo7011,buying them,2025-04-04 09:00:19,3.0,https://reddit.com/r/IndianStreetBets/comments/1jqdyek/indian_it_stocks_crash_heres_all_you_need_to_know/,IndianStreetBets
comment,1jqdyek,,,,,,,ml7k52w,chakka_killer,which site is this ?,2025-04-03 14:54:22,2.0,https://reddit.com/r/IndianStreetBets/comments/1jqdyek/indian_it_stocks_crash_heres_all_you_need_to_know/,IndianStreetBets
post,1kwiutz,will this print? 😅,Intelligent_Panic007,same as title,2025-05-27 09:22:10,0.0,8.0,,,,,,https://reddit.com/r/IndianStreetBets/comments/1kwiutz/will_this_print/,IndianStreetBets
comment,1kwiutz,,,,,,,muhlrpx,abbajabbalanguage,Gaya bete tu toh gaya 😂,2025-05-27 09:45:14,5.0,https://reddit.com/r/IndianStreetBets/comments/1kwiutz/will_this_print/,IndianStreetBets
comment,1kwiutz,,,,,,,muhn6z1,Intelligent_Panic007,no way bhai...mein infosys mein boht gaand ragad rha hu...mujhe laga kuch to fayada hoga 🥲,2025-05-27 09:58:48,3.0,https://reddit.com/r/IndianStreetBets/comments/1kwiutz/will_this_print/,IndianStreetBets
comment,1kwiutz,,,,,,,muhy6jr,Outrageous_Fill_2392,"I am not an expert but these big companies RIL, TCS, infy etc like a elephant and don't move 10% in a day or 2 except election results time. 
So keep finger crossed now",2025-05-27 11:30:46,3.0,https://reddit.com/r/IndianStreetBets/comments/1kwiutz/will_this_print/,IndianStreetBets
comment,1kwiutz,,,,,,,muhw43c,Outrageous_Fill_2392,This stock move 10-12% in a month and it's already cover  8% for May. So it's difficult to reach this at 1600 in 2 days.,2025-05-27 11:15:03,2.0,https://reddit.com/r/IndianStreetBets/comments/1kwiutz/will_this_print/,IndianStreetBets
comment,1kwiutz,,,,,,,muhxfjj,Intelligent_Panic007,i have some ehmm new..i mean newly developed intuition which tells me that maybe Infosys bagged a 350 million contract with Walmart and are just hiding it. /s,2025-05-27 11:25:07,2.0,https://reddit.com/r/IndianStreetBets/comments/1kwiutz/will_this_print/,IndianStreetBets
post,1dihr4q,Portfolio Review (5 Years in),xlplbx,"Don't really know what I'm doing. Have a solid MF investment plan which I follow, any extra cash lying around I dump in stocks I think work. I think I can do better. 

Need an honest opinion on how can I do better. ",2024-06-18 04:08:45,109.0,35.0,,,,,,https://reddit.com/r/IndianStreetBets/comments/1dihr4q/portfolio_review_5_years_in/,IndianStreetBets
comment,1dihr4q,,,,,,,l942gc4,None,If you are doing mf and this is extra cash go for high risk stocks with great returns rather than reliance and l&t. Defence aur power sector k stocks hi ni h aapke portfolio mei,2024-06-18 05:04:44,41.0,https://reddit.com/r/IndianStreetBets/comments/1dihr4q/portfolio_review_5_years_in/,IndianStreetBets
comment,1dihr4q,,,,,,,l946z7h,hollabitch,"Considering taxes etc, profits will allow you to buy < 2 Activas.

So much time and effort just to have purchasing power of 2 Activas.",2024-06-18 05:47:49,23.0,https://reddit.com/r/IndianStreetBets/comments/1dihr4q/portfolio_review_5_years_in/,IndianStreetBets
comment,1dihr4q,,,,,,,l93x2g1,KSK_GAMING,"4 lakh extra cash

Can I kidnap you😭😭",2024-06-18 04:15:01,21.0,https://reddit.com/r/IndianStreetBets/comments/1dihr4q/portfolio_review_5_years_in/,IndianStreetBets
comment,1dihr4q,,,,,,,l949829,Sea-Inspector-8758,"NIFTY has given around ~~50%~~ return in last 5 years, so I think you haven't done so bad.

Edit: it's 100% not 50. You lost on more than 50% potential profits.",2024-06-18 06:12:01,16.0,https://reddit.com/r/IndianStreetBets/comments/1dihr4q/portfolio_review_5_years_in/,IndianStreetBets
comment,1dihr4q,,,,,,,l93yg3e,xlplbx,"Man it kills me everyday, freelance had completely stopped so I had no cash to put into the market. BC all my money was already locked in and in the red. Fuck man.",2024-06-18 04:27:19,13.0,https://reddit.com/r/IndianStreetBets/comments/1dihr4q/portfolio_review_5_years_in/,IndianStreetBets
post,1jfv3ez,GUYS IAM NEW TO THE MARKET SOMEONE TOLD ME TO USE HARMONIC PATTERN INDICATOR DOES IT REALLY WORKS WHAT DO YOU THINK GUYS NO SHIT TALK MFS,COOKED_KOKANE_404,,2025-03-20 17:58:18,0.0,17.0,,,,,,https://reddit.com/r/IndianStreetBets/comments/1jfv3ez/guys_iam_new_to_the_market_someone_told_me_to_use/,IndianStreetBets
comment,1jfv3ez,,,,,,,miu6o3y,Mahigiri21,Tune shit talk karne na bola aur hum maan gaye ![gif](emote|free_emotes_pack|scream),2025-03-20 18:24:27,4.0,https://reddit.com/r/IndianStreetBets/comments/1jfv3ez/guys_iam_new_to_the_market_someone_told_me_to_use/,IndianStreetBets
comment,1jfv3ez,,,,,,,miu2f82,SilukuFann,All the patterns works until it doesn't..,2025-03-20 18:04:07,3.0,https://reddit.com/r/IndianStreetBets/comments/1jfv3ez/guys_iam_new_to_the_market_someone_told_me_to_use/,IndianStreetBets
comment,1jfv3ez,,,,,,,miu2q76,shared20,"If it worked then everyone would do this only. And hence as a result it wouldn’t work. 

Technical analysis is an art. Depends on what each one makes out from the chart and how they trade from that understanding.",2025-03-20 18:05:35,2.0,https://reddit.com/r/IndianStreetBets/comments/1jfv3ez/guys_iam_new_to_the_market_someone_told_me_to_use/,IndianStreetBets
comment,1jfv3ez,,,,,,,mjfdu3u,COOKED_KOKANE_404,"Bro really dropped a philosophical gem like he’s Warren Buffet. Thanks for stating the obvious, Captain Hindsight. 💀",2025-03-24 04:01:49,2.0,https://reddit.com/r/IndianStreetBets/comments/1jfv3ez/guys_iam_new_to_the_market_someone_told_me_to_use/,IndianStreetBets
comment,1jfv3ez,,,,,,,miu19ob,AutoModerator,"Hi, /u/COOKED_KOKANE_404! Welcome to /r/IndianStreetBets!

Use the Daily Discussion Thread for basic queries. Before contributing, do check if your particular question has been answered in the [Wiki](https://www.reddit.com/r/IndianStreetBets/wiki/index). Do utilise the search function to do the same too. Please use proper [post flairs](https://www.reddit.com/r/IndianStreetBets/wiki/index/postflair) and adhere to the rules in the sidebar. You are urged to post beginner questions in the stickied daily discussion thread or on our [Discord in \#beginner-questions channel](https://discord.gg/SeDa9Fhwqv) so as to keep the subreddit as clutter-free as possible. **If this post has good insights or well research, tag the Mods so we can give a shoutout on Discord and get the post more traction** Thank you! 


*I am a bot, and this action was performed automatically. Please [contact the moderators of this subreddit](/message/compose/?to=/r/IndianStreetBets) if you have any questions or concerns.*",2025-03-20 17:58:20,1.0,https://reddit.com/r/IndianStreetBets/comments/1jfv3ez/guys_iam_new_to_the_market_someone_told_me_to_use/,IndianStreetBets
post,1jqfbcs,Pretty uneventful day considering Trump just threw tariffs into the mix,Mr_Vilebur,,2025-04-03 10:54:36,7.0,10.0,,,,,,https://reddit.com/r/IndianStreetBets/comments/1jqfbcs/pretty_uneventful_day_considering_trump_just/,IndianStreetBets
comment,1jqfbcs,,,,,,,ml6inpb,Former-Bid1017,"Somehow it's ""buy the rumor, sell the news.""  

The market had already priced in the tariffs, so the correction happened beforehand. And since the actual news wasn’t as bad as expected, there wasn’t a major drop.",2025-04-03 11:06:30,11.0,https://reddit.com/r/IndianStreetBets/comments/1jqfbcs/pretty_uneventful_day_considering_trump_just/,IndianStreetBets
comment,1jqfbcs,,,,,,,ml6n462,Overpower1601,https://preview.redd.it/54ime769xlse1.png?width=320&format=png&auto=webp&s=ab46a4a31d065ad3b1446efaf8b7d9dfc015e839,2025-04-03 11:41:05,2.0,https://reddit.com/r/IndianStreetBets/comments/1jqfbcs/pretty_uneventful_day_considering_trump_just/,IndianStreetBets
comment,1jqfbcs,,,,,,,ml6h7hz,AutoModerator,"It's awesome that you made a profitable trade. Include reasons why you chose this trade so that new traders can learn. **If the reason for the trade is not mentioned your post will be removed**. Your reason can be as simple as: 'Went long on XYZ FUT because it was near support and had good volumes'. Not sure which flair to use? Check out our guide to post flairs [here](https://www.reddit.com/r/IndianStreetBets/wiki/index/postflair)


*I am a bot, and this action was performed automatically. Please [contact the moderators of this subreddit](/message/compose/?to=/r/IndianStreetBets) if you have any questions or concerns.*",2025-04-03 10:54:38,1.0,https://reddit.com/r/IndianStreetBets/comments/1jqfbcs/pretty_uneventful_day_considering_trump_just/,IndianStreetBets
comment,1jqfbcs,,,,,,,ml6iua6,Jon4snowy,"It was nothing new to Market to react to, knew from the morning the , nifty premiums were too low,there was some iv left in put side even that didn't do nothing.",2025-04-03 11:07:59,1.0,https://reddit.com/r/IndianStreetBets/comments/1jqfbcs/pretty_uneventful_day_considering_trump_just/,IndianStreetBets
comment,1jqfbcs,,,,,,,ml6jpsp,zyxvort,Nifty 50 just went down 0.3% and thats everyday thing bro....,2025-04-03 11:14:59,1.0,https://reddit.com/r/IndianStreetBets/comments/1jqfbcs/pretty_uneventful_day_considering_trump_just/,IndianStreetBets
post,1kgq9mx,added these today to my portfolio 🥳,_zeniith_,,2025-05-07 06:04:01,12.0,5.0,,,,,,https://reddit.com/r/IndianStreetBets/comments/1kgq9mx/added_these_today_to_my_portfolio/,IndianStreetBets
comment,1kgq9mx,,,,,,,mr1vpdv,Brief-Paper5682,wese its very late but still its alright market ne abhi jana hi hai uper,2025-05-07 12:07:24,2.0,https://reddit.com/r/IndianStreetBets/comments/1kgq9mx/added_these_today_to_my_portfolio/,IndianStreetBets
comment,1kgq9mx,,,,,,,mr173sh,_zeniith_,averaging them,2025-05-07 08:30:26,2.0,https://reddit.com/r/IndianStreetBets/comments/1kgq9mx/added_these_today_to_my_portfolio/,IndianStreetBets
comment,1kgq9mx,,,,,,,mr0so7t,AutoModerator,"It's awesome that you made a profitable trade. Include reasons why you chose this trade so that new traders can learn. **If the reason for the trade is not mentioned your post will be removed**. Your reason can be as simple as: 'Went long on XYZ FUT because it was near support and had good volumes'. Not sure which flair to use? Check out our guide to post flairs [here](https://www.reddit.com/r/IndianStreetBets/wiki/index/postflair)


*I am a bot, and this action was performed automatically. Please [contact the moderators of this subreddit](/message/compose/?to=/r/IndianStreetBets) if you have any questions or concerns.*",2025-05-07 06:04:03,1.0,https://reddit.com/r/IndianStreetBets/comments/1kgq9mx/added_these_today_to_my_portfolio/,IndianStreetBets
comment,1kgq9mx,,,,,,,mr0tt9y,None,are you averaging em? Or new positions?,2025-05-07 06:14:46,1.0,https://reddit.com/r/IndianStreetBets/comments/1kgq9mx/added_these_today_to_my_portfolio/,IndianStreetBets
comment,1kgq9mx,,,,,,,mr0ysfs,Fin_Turtle,OK. 🥳,2025-05-07 07:03:24,1.0,https://reddit.com/r/IndianStreetBets/comments/1kgq9mx/added_these_today_to_my_portfolio/,IndianStreetBets
post,1iumyhg,MID CAP 50 will crash,earnmore_money,"as you know market have been falling but now they wil fall harder due to this trigger 

https://preview.redd.it/c6nkgl0ongke1.png?width=1920&format=png&auto=webp&s=050c5924edb830e6ec16f766f2d381dd752dccbd

  


  
behold i have made and investment and if history is right 

  
i will looose money

  
get ready for blood bath bois",2025-02-21 09:25:39,15.0,13.0,,,,,,https://reddit.com/r/IndianStreetBets/comments/1iumyhg/mid_cap_50_will_crash/,IndianStreetBets
comment,1iumyhg,,,,,,,mdymspr,earnmore_money,tell me any shock you wanna get at dicount with power of my bad luck i can make any stock or index fall,2025-02-21 09:26:29,17.0,https://reddit.com/r/IndianStreetBets/comments/1iumyhg/mid_cap_50_will_crash/,IndianStreetBets
comment,1iumyhg,,,,,,,me08u8f,AnxiousVermicelli396,"No mahn. I'll be king as long as I'm in the market.

I have added BEL to my portfolio and BEL is now falling

I've added M&M 2 days ago. And guess what? Dropped nearly 6% today.


Bought ITC recently. Now look at the share prices.

And, what about selling? Sold Ashok Leyland @ 198. Now the share is trading at 225.",2025-02-21 15:57:55,5.0,https://reddit.com/r/IndianStreetBets/comments/1iumyhg/mid_cap_50_will_crash/,IndianStreetBets
comment,1iumyhg,,,,,,,mdzjv70,Starkiller459,I put 1 lac in Suzlon at 50 diamond hands baby,2025-02-21 13:49:37,3.0,https://reddit.com/r/IndianStreetBets/comments/1iumyhg/mid_cap_50_will_crash/,IndianStreetBets
comment,1iumyhg,,,,,,,mdymppt,AutoModerator,"Adhere to the rules in the sidebar. Use the right Flair. Not sure which flair to use? Check out our guide to post flairs [here](https://www.reddit.com/r/IndianStreetBets/wiki/index/postflair). **If this post has good insights or well research, tag the Mods so we can give a shoutout on Discord and get the post more traction**


*I am a bot, and this action was performed automatically. Please [contact the moderators of this subreddit](/message/compose/?to=/r/IndianStreetBets) if you have any questions or concerns.*",2025-02-21 09:25:39,2.0,https://reddit.com/r/IndianStreetBets/comments/1iumyhg/mid_cap_50_will_crash/,IndianStreetBets
comment,1iumyhg,,,,,,,mdyngia,EkPlateStopLoss,suzlon till 40,2025-02-21 09:33:06,2.0,https://reddit.com/r/IndianStreetBets/comments/1iumyhg/mid_cap_50_will_crash/,IndianStreetBets
post,1gfkgp9,Dips to Buy this Diwali ,Hunter_Realistic,"It doesn’t matter what will happen next. What stocks u are keen to add in your portfolio based on the current whatever be the consequences. 
For me it’s Reliance, Zomato, Cipla, Tata motors, DMart, Tata Power. What are yours ?",2024-10-30 11:40:49,26.0,25.0,,,,,,https://reddit.com/r/IndianStreetBets/comments/1gfkgp9/dips_to_buy_this_diwali/,IndianStreetBets
comment,1gfkgp9,,,,,,,luilsvx,trustifying,"ANGELONE, KOTAK, SBICARD, IDFCFIRST BANK",2024-10-30 13:15:30,6.0,https://reddit.com/r/IndianStreetBets/comments/1gfkgp9/dips_to_buy_this_diwali/,IndianStreetBets
comment,1gfkgp9,,,,,,,luixca2,theviableredditor,"I'm tracking the chemical space - SRF, Alkyl, Naveen Flourine",2024-10-30 14:18:56,4.0,https://reddit.com/r/IndianStreetBets/comments/1gfkgp9/dips_to_buy_this_diwali/,IndianStreetBets
comment,1gfkgp9,,,,,,,luiz6wr,None,Tatapower kpitech,2024-10-30 14:28:37,3.0,https://reddit.com/r/IndianStreetBets/comments/1gfkgp9/dips_to_buy_this_diwali/,IndianStreetBets
comment,1gfkgp9,,,,,,,lui7pih,AutoModerator,"Adhere to the rules in the sidebar. Use the right Flair. Not sure which flair to use? Check out our guide to post flairs [here](https://www.reddit.com/r/IndianStreetBets/wiki/index/postflair). **If this post has good insights or well research, tag the Mods so we can give a shoutout on Discord and get the post more traction**


*I am a bot, and this action was performed automatically. Please [contact the moderators of this subreddit](/message/compose/?to=/r/IndianStreetBets) if you have any questions or concerns.*",2024-10-30 11:40:49,2.0,https://reddit.com/r/IndianStreetBets/comments/1gfkgp9/dips_to_buy_this_diwali/,IndianStreetBets
comment,1gfkgp9,,,,,,,luibo7u,damnitrahul,RemindMe! 1 day,2024-10-30 12:10:12,2.0,https://reddit.com/r/IndianStreetBets/comments/1gfkgp9/dips_to_buy_this_diwali/,IndianStreetBets
post,1jtembq,Say hello to pain,Complete_Pizza_6570,"Well well well

Need I say more?",2025-04-07 06:17:37,13.0,7.0,,,,,,https://reddit.com/r/IndianStreetBets/comments/1jtembq/say_hello_to_pain/,IndianStreetBets
comment,1jtembq,,,,,,,mltqgj4,Complete_Pizza_6570,Too much pain though,2025-04-07 06:50:38,2.0,https://reddit.com/r/IndianStreetBets/comments/1jtembq/say_hello_to_pain/,IndianStreetBets
comment,1jtembq,,,,,,,mltn0pt,AutoModerator,"Hi, /u/Complete_Pizza_6570! Welcome to /r/IndianStreetBets!

Use the Daily Discussion Thread for basic queries. Before contributing, do check if your particular question has been answered in the [Wiki](https://www.reddit.com/r/IndianStreetBets/wiki/index). Do utilise the search function to do the same too. Please use proper [post flairs](https://www.reddit.com/r/IndianStreetBets/wiki/index/postflair) and adhere to the rules in the sidebar. You are urged to post beginner questions in the stickied daily discussion thread or on our [Discord in \#beginner-questions channel](https://discord.gg/SeDa9Fhwqv) so as to keep the subreddit as clutter-free as possible. **If this post has good insights or well research, tag the Mods so we can give a shoutout on Discord and get the post more traction** Thank you! 


*I am a bot, and this action was performed automatically. Please [contact the moderators of this subreddit](/message/compose/?to=/r/IndianStreetBets) if you have any questions or concerns.*",2025-04-07 06:17:39,1.0,https://reddit.com/r/IndianStreetBets/comments/1jtembq/say_hello_to_pain/,IndianStreetBets
comment,1jtembq,,,,,,,mltp9k9,BaseballAny5716,"No pain, No gain",2025-04-07 06:40:42,1.0,https://reddit.com/r/IndianStreetBets/comments/1jtembq/say_hello_to_pain/,IndianStreetBets
comment,1jtembq,,,,,,,mltr702,Electrical_Big_9360,"i mean, nifty playing blood bath so yes, lot of pain :)",2025-04-07 06:56:45,1.0,https://reddit.com/r/IndianStreetBets/comments/1jtembq/say_hello_to_pain/,IndianStreetBets
comment,1jtembq,,,,,,,mltqg9z,Complete_Pizza_6570,Too much pain though,2025-04-07 06:50:35,1.0,https://reddit.com/r/IndianStreetBets/comments/1jtembq/say_hello_to_pain/,IndianStreetBets
post,1joncy6,7.8 Lakhs Realised | -6.58 Lakhs Unrealised Loss| So breakeven for FY 2024 2025,Formal-Durian6300,,2025-04-01 04:36:15,36.0,5.0,,,,,,https://reddit.com/r/IndianStreetBets/comments/1joncy6/78_lakhs_realised_658_lakhs_unrealised_loss_so/,IndianStreetBets
comment,1joncy6,,,,,,,mkt4yuj,tejaswin1990,You missed tax loss harvesting clearly,2025-04-01 04:47:53,7.0,https://reddit.com/r/IndianStreetBets/comments/1joncy6/78_lakhs_realised_658_lakhs_unrealised_loss_so/,IndianStreetBets
comment,1joncy6,,,,,,,mkt41ij,kharb9sunil,But why did you not sold this unrealised loss for tax loss harvesting? Or you enjoy paying taxes?,2025-04-01 04:40:01,5.0,https://reddit.com/r/IndianStreetBets/comments/1joncy6/78_lakhs_realised_658_lakhs_unrealised_loss_so/,IndianStreetBets
comment,1joncy6,,,,,,,mkt4c3a,Formal-Durian6300,I missed the tax loss harvesting window!,2025-04-01 04:42:31,3.0,https://reddit.com/r/IndianStreetBets/comments/1joncy6/78_lakhs_realised_658_lakhs_unrealised_loss_so/,IndianStreetBets
