type,post_id,title,author,body,created_timestamp,score,num_comments,comment_id,comment_author,comment_body,comment_created_timestamp,comment_score,permalink,subreddit
post,1i2vg0w,Infy results,No_Milk7979,"Despite Infosys delivering strong results and having a good quarter, why is its ADR down? Can someone help explain? If ADR is down, is it that tomorrow it will crash too?",2025-01-16 18:19:37,3.0,4.0,,,,,,https://reddit.com/r/IndianStockMarket/comments/1i2vg0w/infy_results/,IndianStockMarket
comment,1i2vg0w,,,,,,,m7koo6n,tradelyf_bablo,"Prices are driven by demand and supply.

It is down because there is more supply than demand.",2025-01-17 03:54:32,3.0,https://reddit.com/r/IndianStockMarket/comments/1i2vg0w/infy_results/,IndianStockMarket
comment,1i2vg0w,,,,,,,m7ho79l,AutoModerator,"
Please DO NOT ask for BUY/SELL advice or Portfolio Reviews without sharing your own opinions with reasons first. Such posts will be removed as Low Effort posts. You can repost them in the Daily Discussion Thread.

Please refer to the [FAQ](https://www.reddit.com/r/IndianStockMarket/comments/17bcg2a/frequently asked questions_post_your_common/) where most common questions have already been answered.  

Subscribe to our [weekly newsletter](https://pennyleaks.substack.com/) and join our Discord server using [Link 1](https://discord.gg/fDRj8mA66U) or [Link 2](https://discord.gg/EVgUnQ3CsF)


*I am a bot, and this action was performed automatically. Please [contact the moderators of this subreddit](/message/compose/?to=/r/IndianStockMarket) if you have any questions or concerns.*",2025-01-16 18:19:37,1.0,https://reddit.com/r/IndianStockMarket/comments/1i2vg0w/infy_results/,IndianStockMarket
comment,1i2vg0w,,,,,,,m7l7prv,No_Milk7979,"Well, lost a quite a good sum of money, speculating the results. Lesson learned.",2025-01-17 06:19:05,1.0,https://reddit.com/r/IndianStockMarket/comments/1i2vg0w/infy_results/,IndianStockMarket
comment,1i2vg0w,,,,,,,m7lac53,tradelyf_bablo,"I do the opposite. I sell before results just to avoid bad surprises.
I miss some good moves too but that's the cost of avoiding -20% lower circuits.",2025-01-17 06:42:50,1.0,https://reddit.com/r/IndianStockMarket/comments/1i2vg0w/infy_results/,IndianStockMarket
post,1gutnux,BOUGHT INFY PUTS 1800 SRIKE @12,Effective_Tour6961,"after seeing the sell off I am speculating that the tech giant can go to its 200 ema.

https://preview.redd.it/fnszezfwyt1e1.jpg?width=540&format=pjpg&auto=webp&s=c9fe3ca130389b5bac5cf3e177636f613909d880

",2024-11-19 09:53:28,1.0,7.0,,,,,,https://reddit.com/r/IndianStockMarket/comments/1gutnux/bought_infy_puts_1800_srike_12/,IndianStockMarket
comment,1gutnux,,,,,,,lxwk16i,AutoModerator,"
If you haven't already, please add your own analysis/opinions to your post to save it from being removed for being a Low Effort post.

Please DO NOT ask for BUY/SELL advice without sharing your own opinions with reasons first. Such posts will be removed.

Please also refer to the [FAQ](https://www.reddit.com/r/IndianStockMarket/comments/17bcg2a/frequently asked questions_post_your_common/) where most common questions have already been answered.  

Subscribe to our [weekly newsletter](https://pennyleaks.substack.com/) and join our Discord server using [Link 1](https://discord.gg/fDRj8mA66U) or [Link 2](https://discord.gg/EVgUnQ3CsF)


*I am a bot, and this action was performed automatically. Please [contact the moderators of this subreddit](/message/compose/?to=/r/IndianStockMarket) if you have any questions or concerns.*",2024-11-19 09:53:28,1.0,https://reddit.com/r/IndianStockMarket/comments/1gutnux/bought_infy_puts_1800_srike_12/,IndianStockMarket
comment,1gutnux,,,,,,,lxwo9ac,None,How's the liquidity of options in stocks?,2024-11-19 10:39:12,1.0,https://reddit.com/r/IndianStockMarket/comments/1gutnux/bought_infy_puts_1800_srike_12/,IndianStockMarket
comment,1gutnux,,,,,,,lxwqzfz,Johnginji009,Stocks in nifty 50 usually have good liquidity for current month.,2024-11-19 11:07:04,1.0,https://reddit.com/r/IndianStockMarket/comments/1gutnux/bought_infy_puts_1800_srike_12/,IndianStockMarket
comment,1gutnux,,,,,,,lxxbvp8,Effective_Tour6961,Ok maybe i got fucked here too adr up 5 percent,2024-11-19 13:47:15,1.0,https://reddit.com/r/IndianStockMarket/comments/1gutnux/bought_infy_puts_1800_srike_12/,IndianStockMarket
comment,1gutnux,,,,,,,lxwr38y,Effective_Tour6961,Pretty good,2024-11-19 11:08:06,1.0,https://reddit.com/r/IndianStockMarket/comments/1gutnux/bought_infy_puts_1800_srike_12/,IndianStockMarket
post,1e68f5q,INFY earnings are out,lifeversace,"INFY earnings are out!

* Infosys reported revenues of $4,714 million, reflecting a sequential growth of 3.6% and a year-on-year growth of 2.5% in constant currency terms.

* The operating margin was 21.1%, showing a sequential expansion of 1%.

* Free cash flow reached its highest ever at $1,094 million, a 56.5% increase year-over-year.

* Infosys secured 34 large deals with a total contract value of $4.1 billion.

* Infosys expects revenue growth of 3%-4% in constant currency and an operating margin of 20%-22%.

*Disclaimer: INFY shareholder*",2024-07-18 10:48:37,3.0,16.0,,,,,,https://reddit.com/r/IndianStockMarket/comments/1e68f5q/infy_earnings_are_out/,IndianStockMarket
comment,1e68f5q,,,,,,,ldr72rt,SergenBalastic,"![gif](giphy|l4JyR6dwlPyFNpPFu|downsized)

\*Proceed to fire a couple of thousand employees",2024-07-18 11:18:36,7.0,https://reddit.com/r/IndianStockMarket/comments/1e68f5q/infy_earnings_are_out/,IndianStockMarket
comment,1e68f5q,,,,,,,ldr9ztm,gothCode128,So is it a right time to enter infy?,2024-07-18 11:43:29,3.0,https://reddit.com/r/IndianStockMarket/comments/1e68f5q/infy_earnings_are_out/,IndianStockMarket
comment,1e68f5q,,,,,,,ldr65ye,None,4.1 billion dollars ? Wow,2024-07-18 11:10:33,3.0,https://reddit.com/r/IndianStockMarket/comments/1e68f5q/infy_earnings_are_out/,IndianStockMarket
comment,1e68f5q,,,,,,,ldtb7pz,red_plus_itt,Wonder what they are planning to use that cash for? Mega buy back or bonus shares pls,2024-07-18 18:54:47,3.0,https://reddit.com/r/IndianStockMarket/comments/1e68f5q/infy_earnings_are_out/,IndianStockMarket
comment,1e68f5q,,,,,,,ldr7kdi,Vinay_saini_,Already fired 2000 employees in first qtr to maintain growth in FS,2024-07-18 11:22:50,3.0,https://reddit.com/r/IndianStockMarket/comments/1e68f5q/infy_earnings_are_out/,IndianStockMarket
post,1g52nlv,Thoughts on infy earnings?,I_am_ChristianDick,"Curious what the general sentiment in India is on one of their largest companies 

Bearish outlook: Infosys Limited (Infy) 

🚨 Bearish Outlook on Infosys Limited (INFY) 🚨

Despite Infosys being one of the leading IT service providers, there are growing concerns that the company might face a challenging road ahead. Here's why I'm taking a cautious stance:

Global IT Spending Slowdown: With clients tightening budgets due to economic uncertainties, Infosys may experience a significant slowdown in new contracts and renewal deals, affecting its top-line growth.

Margin Pressures: Increased operational costs.

Client Concentration Risk: A large portion of Infosys' revenues comes from a few key clients. Any pullback from these major clients could lead to revenue volatility.

Challenging U.S. Market: With heightened regulatory scrutiny and visa challenges in the U.S., Infosys may struggle to maintain its growth trajectory in its largest market. This could particularly impact their talent deployment and client service levels.

Valuation Concerns: Infosys is trading at a relatively high P/E ratio compared to its historical average and peers, suggesting the stock could be overvalued in the current environment. Any earnings miss could lead to a sharp correction.

📉 Technical Weakness: From a technical standpoint, INFY has been showing signs of weakening, with key support levels being tested. A break below these levels could trigger further downside. Nearing a 52-week high into earnings is risky. Whether that be pure speculation or a recipe for disaster.

🚫 While Infosys has long been a leader in the industry, the road ahead looks uncertain, and the risks are mounting. Investors should proceed with caution or consider reducing exposure.

Although, they are looking to expand into the AI industry further. Future acquisitions are costly. And the current AI front runners are not at the level where many of the services may be relevant.

Additionally, consulting industry is on a downwind. Gearing towards further reduced sales moving forward on an already low PEG.",2024-10-16 15:52:21,2.0,2.0,,,,,,https://reddit.com/r/IndianStockMarket/comments/1g52nlv/thoughts_on_infy_earnings/,IndianStockMarket
comment,1g52nlv,,,,,,,ls7uefj,AutoModerator,"
If you haven't already, please add your own analysis/opinions to your post to save it from being removed for being a Low Effort post.

Please DO NOT ask for BUY/SELL advice without sharing your own opinions with reasons first. Such posts will be removed.

Please also refer to the [FAQ](https://www.reddit.com/r/IndianStockMarket/comments/17bcg2a/frequently asked questions_post_your_common/) where most common questions have already been answered.  

Subscribe to our [weekly newsletter](https://pennyleaks.substack.com/) and join our Discord server using [Link 1](https://discord.gg/fDRj8mA66U) or [Link 2](https://discord.gg/EVgUnQ3CsF)


*I am a bot, and this action was performed automatically. Please [contact the moderators of this subreddit](/message/compose/?to=/r/IndianStockMarket) if you have any questions or concerns.*",2024-10-16 15:52:21,1.0,https://reddit.com/r/IndianStockMarket/comments/1g52nlv/thoughts_on_infy_earnings/,IndianStockMarket
comment,1g52nlv,,,,,,,ls7x4e6,NGPlus_,"Annoying Company. Most of them. You have to keep looking for Hyperscalers in tech space . Currently I Feel it's Persistent System , KPIT , Tomorrow it could be something else.   
At the end of the day these are outsourcing companies nothing Fancy about them",2024-10-16 16:06:43,1.0,https://reddit.com/r/IndianStockMarket/comments/1g52nlv/thoughts_on_infy_earnings/,IndianStockMarket
post,1e6938f,Infy,Silkil20,Will the stock price rise tomorrow?,2024-07-18 11:28:52,2.0,6.0,,,,,,https://reddit.com/r/IndianStockMarket/comments/1e6938f/infy/,IndianStockMarket
comment,1e6938f,,,,,,,ldr8xe8,lifeversace,ADR went up 4% after the results. So we should see a 2-3% movement easily tomorrow.,2024-07-18 11:34:37,3.0,https://reddit.com/r/IndianStockMarket/comments/1e6938f/infy/,IndianStockMarket
comment,1e6938f,,,,,,,ldr89jz,AutoModerator,"
If you haven't already, please add your own analysis/opinions to your post to save it from being removed for being a Low Effort post.

Please DO NOT ask for BUY/SELL advice without sharing your own opinions with reasons first. Such posts will be removed.

Please also refer to the [FAQ](https://www.reddit.com/r/IndianStockMarket/comments/17bcg2a/frequently asked questions_post_your_common/) where most common questions have already been answered.  

Subscribe to our [weekly newsletter](https://pennyleaks.substack.com/) and join our Discord server using [Link 1](https://discord.gg/8QF4dqPHuw) or [Link 2](https://discord.gg/fDRj8mA66U)


*I am a bot, and this action was performed automatically. Please [contact the moderators of this subreddit](/message/compose/?to=/r/IndianStockMarket) if you have any questions or concerns.*",2024-07-18 11:28:52,1.0,https://reddit.com/r/IndianStockMarket/comments/1e6938f/infy/,IndianStockMarket
comment,1e6938f,,,,,,,ldt0exu,Heyman068,"Infy ADR up 9%, what can we expect tomorrow?",2024-07-18 17:56:16,1.0,https://reddit.com/r/IndianStockMarket/comments/1e6938f/infy/,IndianStockMarket
comment,1e6938f,,,,,,,ldt12uc,Silkil20,Nifty ab ki baar 26000,2024-07-18 17:59:55,1.0,https://reddit.com/r/IndianStockMarket/comments/1e6938f/infy/,IndianStockMarket
comment,1e6938f,,,,,,,ldr99bg,Silkil20,Adr is minus,2024-07-18 11:37:25,1.0,https://reddit.com/r/IndianStockMarket/comments/1e6938f/infy/,IndianStockMarket
post,1dc1ro7,IT Stocks rally - Infy & Wipro up by 10% in the last 3 days.,JRBatHolmes,"Other IT stocks are also having a good run these past 3 days.   
But I'm not finding any trigger, am I missing something?",2024-06-09 19:21:35,2.0,2.0,,,,,,https://reddit.com/r/IndianStockMarket/comments/1dc1ro7/it_stocks_rally_infy_wipro_up_by_10_in_the_last_3/,IndianStockMarket
comment,1dc1ro7,,,,,,,l7v1tyo,Imosaf,"Rate cuts in Canada and Europe , not long before Fed will join them",2024-06-09 20:03:36,3.0,https://reddit.com/r/IndianStockMarket/comments/1dc1ro7/it_stocks_rally_infy_wipro_up_by_10_in_the_last_3/,IndianStockMarket
comment,1dc1ro7,,,,,,,l7uurvl,AutoModerator,"
If you haven't already, please add your own analysis/opinions to your post to save it from being removed for being a Low Effort post.

Please DO NOT ask for BUY/SELL advice without sharing your own opinions with reasons first. Such posts will be removed.

Please also refer to the [FAQ](https://www.reddit.com/r/IndianStockMarket/comments/17bcg2a/frequently asked questions_post_your_common/) where most common questions have already been answered.  

Subscribe to our [weekly newsletter](https://pennyleaks.substack.com/) and join our Discord server using [Link 1](https://discord.gg/8QF4dqPHuw) or [Link 2](https://discord.gg/fDRj8mA66U)


*I am a bot, and this action was performed automatically. Please [contact the moderators of this subreddit](/message/compose/?to=/r/IndianStockMarket) if you have any questions or concerns.*",2024-06-09 19:21:35,1.0,https://reddit.com/r/IndianStockMarket/comments/1dc1ro7/it_stocks_rally_infy_wipro_up_by_10_in_the_last_3/,IndianStockMarket
post,1enq0fb,"Market is green, what are you buying/selling today?",officialazhark,"https://preview.redd.it/fcn0mb5u8khd1.png?width=1901&format=png&auto=webp&s=567d38f0f2b2b4b997c2dde061c2bd78bfb69eb2

So as expected, market is green today. What are you buying selling today?

  
In my case, i will mostly sell all my IRB shares if it crosses 66.",2024-08-09 03:49:09,155.0,170.0,,,,,,https://reddit.com/r/IndianStockMarket/comments/1enq0fb/market_is_green_what_are_you_buyingselling_today/,IndianStockMarket
comment,1enq0fb,,,,,,,lh87swr,AccomplishedBrick304,"Bought prestige estates, the entire company",2024-08-09 04:42:19,106.0,https://reddit.com/r/IndianStockMarket/comments/1enq0fb/market_is_green_what_are_you_buyingselling_today/,IndianStockMarket
comment,1enq0fb,,,,,,,lh8e9du,None,Inner peace. Already bought when it dipped!,2024-08-09 05:41:17,64.0,https://reddit.com/r/IndianStockMarket/comments/1enq0fb/market_is_green_what_are_you_buyingselling_today/,IndianStockMarket
comment,1enq0fb,,,,,,,lh87t52,cursed_aka_blessed,Waiting for my portfolio to turn green,2024-08-09 04:42:22,48.0,https://reddit.com/r/IndianStockMarket/comments/1enq0fb/market_is_green_what_are_you_buyingselling_today/,IndianStockMarket
comment,1enq0fb,,,,,,,lh859qs,saber069,Did he say you have to? Phokat ka gyan apne paas rakh,2024-08-09 04:20:54,41.0,https://reddit.com/r/IndianStockMarket/comments/1enq0fb/market_is_green_what_are_you_buyingselling_today/,IndianStockMarket
comment,1enq0fb,,,,,,,lh88vue,officialazhark,For 	68.19KCr?,2024-08-09 04:51:41,35.0,https://reddit.com/r/IndianStockMarket/comments/1enq0fb/market_is_green_what_are_you_buyingselling_today/,IndianStockMarket
post,1k8xx04,Earnings Season = Dividends Galore!,disc_jockey77,"50% of my stock portfolio is made up of large cap dividend yield stocks so earnings season means a few lakhs of dividends hitting my account and I like the sound of that. Infy, HDFC Bank, Bank of Maharashtra, HCL Tech, IEX, Page, Godrej Consumer, CRISIL, Mazgaon are stocks in my portfolio that have announced dividends so far! Who else is reaping dividend benefits?!",2025-04-27 06:59:11,71.0,61.0,,,,,,https://reddit.com/r/IndianStockMarket/comments/1k8xx04/earnings_season_dividends_galore/,IndianStockMarket
comment,1k8xx04,,,,,,,mpa2hwc,Capital-Freedom8588,lakhs dividend kamne ke liye crore invest karna padhta hai hum gareeb hein,2025-04-27 07:42:27,45.0,https://reddit.com/r/IndianStockMarket/comments/1k8xx04/earnings_season_dividends_galore/,IndianStockMarket
comment,1k8xx04,,,,,,,mp9z2js,Electronic_Usual7945,"Yes, I'm also patiently staring at my account like it's a magic pot, waiting for that glorious dividend to drop in!",2025-04-27 07:07:27,28.0,https://reddit.com/r/IndianStockMarket/comments/1k8xx04/earnings_season_dividends_galore/,IndianStockMarket
comment,1k8xx04,,,,,,,mpa2oye,disc_jockey77,Suddenly nahi kiya hain. Accumulated gradually over many years.,2025-04-27 07:44:27,19.0,https://reddit.com/r/IndianStockMarket/comments/1k8xx04/earnings_season_dividends_galore/,IndianStockMarket
comment,1k8xx04,,,,,,,mpa9qpa,AdCertain5974,Reliance gave out 5.5 😵‍💫 thank god i have the king of dividends (Lord ITC)🙌🏻,2025-04-27 08:57:36,15.0,https://reddit.com/r/IndianStockMarket/comments/1k8xx04/earnings_season_dividends_galore/,IndianStockMarket
comment,1k8xx04,,,,,,,mpagpch,amitsingh80108,"PSUs = dividend. 
Because the government needs cash to run",2025-04-27 10:11:58,10.0,https://reddit.com/r/IndianStockMarket/comments/1k8xx04/earnings_season_dividends_galore/,IndianStockMarket
post,1eci0yn,Why is nifty rising??,atgIsOnRedditNOW,Basically the title. The budget and sebi and RBI everyone is  of negative opinion against stock market. Then why the hell is it up?? I was expecting some correction. Are all of new investors so optimistic??,2024-07-26 07:21:44,118.0,115.0,,,,,,https://reddit.com/r/IndianStockMarket/comments/1eci0yn/why_is_nifty_rising/,IndianStockMarket
comment,1eci0yn,,,,,,,lf017dy,Razor-007,"New investors every 2nd week, correction is coming, market falls 1% they say crash happened, should i sell my holding etc etc. There isnt any -ve news that can make the market go down",2024-07-26 07:36:23,199.0,https://reddit.com/r/IndianStockMarket/comments/1eci0yn/why_is_nifty_rising/,IndianStockMarket
comment,1eci0yn,,,,,,,lf02md6,jumbovada,because you bought the puts that's why,2024-07-26 07:52:05,75.0,https://reddit.com/r/IndianStockMarket/comments/1eci0yn/why_is_nifty_rising/,IndianStockMarket
comment,1eci0yn,,,,,,,lf01ymp,Mickeythesame,"R&R Cycle repeats every quarter, people are fkn goldfish.",2024-07-26 07:44:46,55.0,https://reddit.com/r/IndianStockMarket/comments/1eci0yn/why_is_nifty_rising/,IndianStockMarket
comment,1eci0yn,,,,,,,lf0891u,None,In long run market follow fundamentals not emotions,2024-07-26 08:55:19,47.0,https://reddit.com/r/IndianStockMarket/comments/1eci0yn/why_is_nifty_rising/,IndianStockMarket
comment,1eci0yn,,,,,,,lf06brc,joyfulparrot,"It's the earning season. Many companies are showing good growth in revenue and profit. Liquidity is high, interest rates will be reduced in a few months. GDP growth is good.   
What the hell is negative? 12.5% tax is low. 

(Personal analysis, not an investment suggestion.)",2024-07-26 08:33:44,41.0,https://reddit.com/r/IndianStockMarket/comments/1eci0yn/why_is_nifty_rising/,IndianStockMarket
post,1j9dxk5,Real estate can be casualty in India .,lone_warrior1310,"With IT professionals future in doldrums , many real estate projects can be hampered . ",2025-03-12 06:58:44,66.0,63.0,,,,,,https://reddit.com/r/IndianStockMarket/comments/1j9dxk5/real_estate_can_be_casualty_in_india/,IndianStockMarket
comment,1j9dxk5,,,,,,,mhcupss,3D_Noob_Guy,Real estate market in india is overvalued and in a bubble and that bubble isn't bursting anytime soon because of how much black money is hoarded behind it.,2025-03-12 09:18:05,107.0,https://reddit.com/r/IndianStockMarket/comments/1j9dxk5/real_estate_can_be_casualty_in_india/,IndianStockMarket
comment,1j9dxk5,,,,,,,mhcj8y6,ImSorted110,"Yes, the effects are already imminent. I am getting spam calls from all the projects where I visited for enquiry. They show little to no concern at the time of enquiry, but get desperate later offering discounts which they refused already.

Wait until people holding black money find a better way to park their money. For now real estate remains best and safe for them.",2025-03-12 07:13:07,50.0,https://reddit.com/r/IndianStockMarket/comments/1j9dxk5/real_estate_can_be_casualty_in_india/,IndianStockMarket
comment,1j9dxk5,,,,,,,mhcw261,kunda-linis,Only IT professionals don’t run this market! There are many business owners  in different sectors who have got enough money to pump in real estate,2025-03-12 09:32:21,43.0,https://reddit.com/r/IndianStockMarket/comments/1j9dxk5/real_estate_can_be_casualty_in_india/,IndianStockMarket
comment,1j9dxk5,,,,,,,mhcyjdj,NewWheelView,"Real estate market will never go down in India. A lot of money is black, hoarded in real estate. The owners of this black money can hold the property for years, rather than selling it at a discount. 

So the prices are never going to come down. They can stay stagnant at worst.",2025-03-12 09:57:53,25.0,https://reddit.com/r/IndianStockMarket/comments/1j9dxk5/real_estate_can_be_casualty_in_india/,IndianStockMarket
comment,1j9dxk5,,,,,,,mhcz8ie,general1234456,"Believe me when I say everything will go down if IT goes down. Real estate is the easiest casualty. An entire middle class is being propped by IT. Even small businesses and entrepreneurs, doctors will see a downtrend of earnings.",2025-03-12 10:04:48,16.0,https://reddit.com/r/IndianStockMarket/comments/1j9dxk5/real_estate_can_be_casualty_in_india/,IndianStockMarket
post,1isytxk,Is Indian market meant for rich people?,undervaluedequity,"Whenever I think of Indian market, I feel like Indian market is made for rich people. Those people who have less capital let's say 3-4 lac, they can't hedge their stocks or index investment by selling in options. Options selling are risky but if you have stock of that quantity, you are either earning margins or booking profit, even if your equity investment goes down because of bear market, some of those losses gets covered by margins of option selling. Now if you have 30-40 shares of Infy you can't sell call option of lot size 400 for hedging. You. Need to have lot size 40. 

Also in gold lots, you can not buy gold in 10 grams or 100 grams over here. It is indeed disappointing. Does anyone feels the same?",2025-02-19 06:18:05,45.0,64.0,,,,,,https://reddit.com/r/IndianStockMarket/comments/1isytxk/is_indian_market_meant_for_rich_people/,IndianStockMarket
comment,1isytxk,,,,,,,mdknb0e,srivignesh_ms,"Go with mutual funds. These funds pool money from many people and can do all the things you mentioned, like covered calls, hedging and more. Invest in a low-cost mutual fund and set up a SIP for decent growth.  

For gold, consider buying gold ETFs like GoldBEES. They’re a simple and cost-effective way to invest in gold without dealing with physical storage.",2025-02-19 06:26:46,49.0,https://reddit.com/r/IndianStockMarket/comments/1isytxk/is_indian_market_meant_for_rich_people/,IndianStockMarket
comment,1isytxk,,,,,,,mdkniw9,Ryujiro1,"It's meant for people with right mindset and good financial knowledge. If u r low salaried IT employee earning 30k per month, u can still get rich through mutual funds sip.",2025-02-19 06:28:41,29.0,https://reddit.com/r/IndianStockMarket/comments/1isytxk/is_indian_market_meant_for_rich_people/,IndianStockMarket
comment,1isytxk,,,,,,,mdkp505,Kindly_Truck3210,"That's true for all of India.
There's 2 indias.
One that is rich and can afford a car and things like investment.
The rest some 80-90+% of the population just wondering where their food is gonna come from.",2025-02-19 06:42:45,22.0,https://reddit.com/r/IndianStockMarket/comments/1isytxk/is_indian_market_meant_for_rich_people/,IndianStockMarket
comment,1isytxk,,,,,,,mdktg4y,Sudden-Blacksmith717,"Lol, you forgot to mention that black money can be parked in physical gold. There are multiple ways of dealing with LTCG tax if you hold gold rather etf. My favourite one is that if you want to hold it for long duration (30-35yrs) then holding cost is much less than management fees. Everyone's investment objectives is different but gold has something for all of us. I love the rare yellow metal which can be exchanged anywhere in the world (whether NY, Mumbai, Beijing, or Capetown). Moreover, everyone loves it. Strongest currency for thousands of years and still counting.",2025-02-19 07:22:03,14.0,https://reddit.com/r/IndianStockMarket/comments/1isytxk/is_indian_market_meant_for_rich_people/,IndianStockMarket
comment,1isytxk,,,,,,,mdkxj6v,kraken_enrager,"My parents are CAs, highly literate financially and actively involved and updated about the markets, regulations, etc. 

Despite that, a very large majority of our equity investments are tied up in MFs, ETFs and index funds. The only individual stock holdings we have are either long term positions in companies or emerging companies suggested by our wealth manager.   

It’s stupid to think that an average bloke, no matter how financially literate can do better than career professionals. People need to stop treating stocks like a shortcut to wealth.",2025-02-19 08:01:31,10.0,https://reddit.com/r/IndianStockMarket/comments/1isytxk/is_indian_market_meant_for_rich_people/,IndianStockMarket
post,1fezl5f,Where's the crash?,officialazhark,"https://preview.redd.it/ak9oh9lwycod1.png?width=1310&format=png&auto=webp&s=5fcab45ae0e551f37b14b2713890f67e86b4ce92

Have been hearing about crash for almost 2-3 months, every time it dips it recovers. Who is still waiting for crash? And have good amount of liquid cash to deploy?",2024-09-12 10:49:57,29.0,43.0,,,,,,https://reddit.com/r/IndianStockMarket/comments/1fezl5f/wheres_the_crash/,IndianStockMarket
comment,1fezl5f,,,,,,,lmqvjz7,None,I bought large cap when people were talking about crash in last month,2024-09-12 10:51:24,39.0,https://reddit.com/r/IndianStockMarket/comments/1fezl5f/wheres_the_crash/,IndianStockMarket
