title,link,date
"Announcement under Regulation 30 (LODR)-Earnings Call Transcript 19h - Britannia Q4 FY25 earnings call: 6% revenue growth, 12.5% PAT margin, strong adjacencies, cost savings, optimistic outlook.",https://www.bseindia.com/stockinfo/AnnPdfOpen.aspx?Pname=acd82c4a-11a3-4222-89d1-326b1d124460.pdf,"19h - Britannia Q4 FY25 earnings call: 6% revenue growth, 12.5% PAT margin, strong adjacencies, cost savings, optimistic outlook."
Announcement under Regulation 30 (LODR)-Analyst / Investor Meet - Outcome 12 May - Audio recording of Britannia's Q4 and FY25 financial results analyst call shared.,https://www.bseindia.com/stockinfo/AnnPdfOpen.aspx?Pname=5248ce9e-911f-4312-bf74-a7c080970aa3.pdf,12 May - Audio recording of Britannia's Q4 and FY25 financial results analyst call shared.
"Announcement under Regulation 30 (LODR)-Investor Presentation 12 May - Read with Clause 15 of Para A of Part A of Schedule III of the SEBI Listing Regulations, 2015, please find enclosed the copy of …",https://www.bseindia.com/stockinfo/AnnPdfOpen.aspx?Pname=f7940029-9c13-4abf-876e-159667d5c27a.pdf,"12 May - Read with Clause 15 of Para A of Part A of Schedule III of the SEBI Listing Regulations, 2015, please find enclosed the copy of …"
"Announcement under Regulation 30 (LODR)-Newspaper Publication 9 May - Listing Regulations, 2015, please find enclosed copies of the newspaper advertisement published on 9th May, 2025 for the Audited Consolidated and Standalone Financial Results of …",https://www.bseindia.com/stockinfo/AnnPdfOpen.aspx?Pname=208dd8d2-a6e4-4f35-abc9-6d012952d207.pdf,"9 May - Listing Regulations, 2015, please find enclosed copies of the newspaper advertisement published on 9th May, 2025 for the Audited Consolidated and Standalone Financial Results of …"
"Appointment And Re-Appointment Of Auditors - Intimation Under Regulation 30 Of The SEBI(LODR Regulations), 2015 8 May - Re-appointment of Walker Chandiok & Co. and appointment of Parikh & Associates as auditors for five years.",https://www.bseindia.com/stockinfo/AnnPdfOpen.aspx?Pname=d3ebe82c-fe73-4116-9887-ff7422134c90.pdf,8 May - Re-appointment of Walker Chandiok & Co. and appointment of Parikh & Associates as auditors for five years.
