fund_name,latest_nav,percentage_change,asset_size,1_month_return,3_month_return,6_month_return,1_year_return,3_year_return,5_year_return,star_rating
JM Value Fund Growth,97.71,0.12,1036.42,6.15,15.8,-5.59,9.39,27.49,28.97,4
HSBC Value Growth,108.5,0.52,13095.25,5.74,18.4,-2.98,13.72,26.53,29.7,4
Quant Value Fund Regular Growth,19.32,0.3,1734.34,4.51,12.52,-7.08,-0.95,25.29,,3
Axis Value Fund Regular Growth,18.19,0.78,853.13,4.15,12.53,-3.27,16.08,24.83,,4
Nippon India Value Fund - Growth,221.71,0.23,8382.57,3.13,12.23,-3.18,14.09,24.44,29.21,4
