title,link,date
"Update on board meeting 20h - Board meeting on May 23 to consider FY25 results, dividend, and possible long-term fund raising.",https://www.bseindia.com/stockinfo/AnnPdfOpen.aspx?Pname=b52186db-cf67-4d28-832d-f363d80f4807.pdf,"20h - Board meeting on May 23 to consider FY25 results, dividend, and possible long-term fund raising."
"Compliances-Reg.24(A)-Annual Secretarial Compliance 1d - Annual Secretarial Compliance Report for FY ended March 31, 2025 submitted to stock exchanges.",https://www.bseindia.com/stockinfo/AnnPdfOpen.aspx?Pname=371b0089-61fb-41c5-937b-1fdf5775f885.pdf,"1d - Annual Secretarial Compliance Report for FY ended March 31, 2025 submitted to stock exchanges."
"Announcement under Regulation 30 (LODR)-Credit Rating 2d - JSW Steel credit ratings stable by CARE, ICRA; India Ratings watch with developing implications.",https://www.bseindia.com/stockinfo/AnnPdfOpen.aspx?Pname=2071c144-da20-4eb3-b71a-c7eb5912a8e3.pdf,"2d - JSW Steel credit ratings stable by CARE, ICRA; India Ratings watch with developing implications."
Revisionary Authority Has Set Aside The Demand Notices Of Deputy Director Of Mines For Rs. 702 Crores. 2 May - Revisionary Authority set aside Rs. 702 Cr mining claim; matter remanded for proper hearing.,https://www.bseindia.com/stockinfo/AnnPdfOpen.aspx?Pname=d8b99fb9-ac8e-4eda-8599-19c6d706b3cc.pdf,2 May - Revisionary Authority set aside Rs. 702 Cr mining claim; matter remanded for proper hearing.
"Clarification/Confirmation On News Article Appearing In Moneycontrol Dated May 02, 2025 2 May - SC rejects JSW Steel's Bhushan Power resolution plan, a major legal setback on May 2, 2025.",https://www.bseindia.com/stockinfo/AnnPdfOpen.aspx?Pname=4bf44a30-2489-4bfa-b91d-ab250c1572a8.pdf,"2 May - SC rejects JSW Steel's Bhushan Power resolution plan, a major legal setback on May 2, 2025."
